<?xml version="1.0"?>

<!--
<!DOCTYPE rfc SYSTEM "rfc2629.dtd">
-->

<?rfc toc="yes" ?>
<?rfc topblock="yes" ?>
<?rfc symrefs="yes" ?>
<?rfc sortrefs="yes" ?>
<?rfc compact="yes" ?>
<?rfc private="Version 1.1" ?>

<rfc xmlns="http://www.rfc2629.org"
  xmlns:xsi="http://www.w3.org/2001/XMLSchema-instance"
  xsi:schemaLocation="http://www.rfc2629.org rfc2629.xsd"
  ipr="full3978" docName="UNAPI">

	<!-- Header -->

	<front>
		<title abbrev="MSX-UNAPI">MSX-UNAPI: Unified procedure for API definition and discovery on MSX computers</title>
		<author initials="N." surname="Soriano" fullname="Nestor Soriano">
			<organization>MSX community</organization>
			<address>
				<email>konamiman@konamiman.com</email>
				<uri>http://www.konamiman.com</uri>
			</address>
		</author>
		<date month="February" year="2010" />
		<abstract>
			<t>This document describes MSX-UNAPI, a standard procedure for defining, discovering and using new APIs (Application Program Interfaces)
			for MSX computers. The goal is to provide a unified way to design and use BIOS-like software for the various kinds of new hardware that is
			being developed for these computers, altough it can be used for software-only solutions as well.</t>
		</abstract>
	</front>

	<middle>
	
		<!-- Introduction -->
	
		<section anchor="intro" title="Introduction">
			<section anchor="motivation" title="Motivation">
				<t>MSX was presented in 1983 as a standard for home computers, in the form of a set of specifications to be followed by manufacturers.
				Any brand was able to make its own model of computer; as long as the machine met the MSX standard, it was considered an MSX computer.
				This allowed for flawless interoperation between computers of different makers, something not as common at the time as it is nowadays.</t>
				
				<t>An important part of the MSX specification was the BIOS, a set of routines that -amongst other things- provided a standarized way
				to access the harwdare resources of the machine. This provided certain degree of freedom to manufacturers, which could -to some extent-
				freely choose the hardware parts that would build up their given model of MSX computer.</t>
				
				<t>Time passed and the MSX standard was discontinued by all manufacturers long time ago. However, many people still using their old MSX computers,
				and some of them even develop new hardware for these machines. Hard disk interfaces, sound cards and network cards are examples of hardware
				that has been developed for MSX computers past the commercial live of the standard.</t>
				
				<t>Altough the appearance of new hardware is of course a good thing, this causes a problem for software developers. Not having any authority
				dictating specifications for the MSX standard anymore, each hardware developer freely choses the way their hardware will have to be
				accessed from software; in other words, there are no specifications to follow at the time of designing the API (Application Program Interface)
				for the new harwdare. As a result, hardware extensions performing the same functions but being developed by different persons are software-incompatible
				(unless developers privately agree on using compatible APIs, which is not always possible).</t>
				
				<t>The intent of this document is to propose a solution for this problem:
				a standard, unified procedure for defining, discovering and using new APIs for MSX computers, aimed especially (but not exclusively)
				to the hardware development field.</t>
			</section>
			
			<section anchor="goals" title="Goals">
				<t>The main goals of this specification are:</t>
				<vspace blankLines='1' />
					<list style="symbols">
						<t>To provide a minimum set of rules to be followed by APIs that adhere to this specification. These rules are to be taken in account
						when designing (and later implementing) the various APIs. They are very simple, impose only a few restrictions on compliant code,
						and in practice allow any kind of API software to be written.</t>
						<vspace blankLines='1' />
						<t>To provide a standard procedure for discovering and using APIs that adhere to this standard and are installed
						on the MSX computer running the UNAPI aware software. This procedure is based on the MSX extended BIOS mechanism,
						and is very easy to implement and even easier to use.</t>
					</list>
			</section>
			
			<section anchor="nongoals" title="Non-goals">
				<t>It is NOT the intent of this specification, and/or is outside the scope of this document:</t>
				<vspace blankLines='1' />
					<list style="symbols">
						<t>To impose the described specification to developers or users. Altough the authors hope that the MSX-UNAPI specification
						will be useful for the MSX community, this document is merely a proposal, and adhering to it is of course optional.</t>
						<vspace blankLines='1' />
						<t>To arbiter who should desing the APIs. Common sense suggests that APIs should be designed by the first person or team that develops
						a given type of hardware (or software), but the decision of such thing is outside the scope of this document.</t>
						<vspace blankLines='1' />
						<t>To describe any API other than for illustration purposes. This documents just tells a procedure for designing APIs;
						these must be described in sepparate documents.</t> 
					</list>
			</section>
			
			<section anchor="glossary" title="Glossary">
				<t>Before proceeding any further, a glossary of terms used along this document will be introduced. It will be useful
				to understand the rules and procedures described later.</t>
				<t>MSX-UNAPI</t>
					<list style="empty"><t>Short for "MSX unified API definition and discovery standard". A set of rules to be followed when designing
					and implementing APIs, aimed mainly (but not exclusively) to hardware developers; and a procedure for discovering any such APIs available
					to application software.</t></list>
				<t>API specification</t>
					<list style="empty"><t>API stands for "Application Program Interface". The description of a set of routines that perform some action
					(which usually, but not necessarily, involve accessing some kind of hardware), including the precise description
					of input and output parameters, as well as the side effects caused by the execution of each routine.</t></list>
				<t>UNAPI compliant API specification</t>
					<list style="empty"><t>An API specification that conforms to the rules for API specifications described in this document.</t></list>
				<t>API specification identifier</t>
					<list style="empty"><t>An alphanumeric, case-insensitive string made of up to 15 characters, which uniquely identifies an UNAPI compliant
					API specification. For example the identifier of an API specification for Ethernet cards could be "ETHERNET". See <xref target="apirule1" />
					for more details.</t></list>
				<t>The XXXXX UNAPI specification</t>
					<list style="empty"><t>The specification for an UNAPI compliant API whose specification identifier is XXXXX.
					For example, "the Ethernet UNAPI specification".</t></list>
				<t>XXXXX UNAPI compliant API implementation</t>
					<list style="empty"><t>Real code that builds up a set of routines which conforms to an UNAPI compliant API specification (and more
					precisely, to the XXXXX UNAPI specification). There may be several implementations of one single specification, each made by a
					different person or team; but if they strictly conform to the API specification, they are indistinguishable with respect to usage
					and behavior.</t></list>
				<t>API implementation name</t>
					<list style="empty"><t>An alphanumeric string made of up to 63 characters, which uniquely identifies an API implementation.
					For example the name of an implementation of the Ethernet UNAPI could be "ObsoNET", while the name of
					other implementation could be "UltraNET Supercard". See <xref target="apirule5" /> for more details.</t></list>
				<t>XXXXX UNAPI client software</t>
					<list style="empty"><t>Application software that invokes the routines of an XXXXX UNAPI compliant API implementation.
					For example, a TCP/IP stack could act as client software of the Ethernet UNAPI. The client software must use
					the discovery procedure (see <xref target="discovery" />) to locate the available API implementations, and usually it does not matter which
					one is used if more than one is found.</t></list>
        <t>Specificationless UNAPI application</t>
        <list style="empty">
          <t>
            Application software (typically, a resident application) that does not conform to any concrete UNAPI specification,
            but that make use of the remaining of the UNAPI infrastructure, namely, the implementation and discovery rules.
            See <xref target="specless" /> for more details.
        </t>
        </list>
        <t>#FF</t>
					<list style="empty"><t>Character # is used in this document as a prefix for hexadecimal numbers, so for example #FF is 255.</t></list>
				<t>Through this document, and unless otherwise stated, the term "API specification" will actually have the meaning of "UNAPI compliant API specification".
				The same applies to references to API implementations.</t>
			</section>
			
			<section anchor="samplescenario" title="Sample scenario">
				<t>This section provides an fictional scenary that briefly shows the steps that are needed in order to design and implement UNAPI compliant APIs.
				The goal is to provide the reader a basic understanding about how all the whole thing works, so that it is easier to read
				the detailed rules and procedures that are provided in the remaining of the document.</t>